{
  "id": "zhong_qi_xia_xian",
  "name": "中氣下陷證",
  "alias": ["氣陷證", "脾氣下陷", "氣虛下陷"],
  "zhengsu_composition": {
    "location": ["pi"],
    "nature": ["qi_xu", "qi_xian"]
  },
  "pathogenesis": "氣陷證是因先天不足、後天失調造成元氣虧損，氣機升降失常，出現以中氣下陷、升舉無力為特徵的證候。屬於氣虛病變中的一個常見類型，多見於內傷雜病。",
  "symptoms": {
    "main": ["氣短乏力", "神疲懶言", "脘腹脹墜", "久泄脫肛", "陰挺", "帶下"],
    "secondary": ["頭暈眼花", "少腹墜脹", "內臟下垂感"],
    "tongue": "舌質淡胖",
    "pulse": "脈細緩無力"
  },
  "treatment_principle": ["補氣升陽", "升舉中氣"],
  "recommended_formulas": ["buzhongyiqi_tang"],
  "recommended_herbs": ["huang_qi", "ren_shen", "sheng_ma", "chai_hu", "bai_zhu"],
  "evolved_from": ["qi_xu_zheng", "pi_qi_xu"],
  "differentiate_from": ["qi_tuo_zheng", "qingyang_busheng_zheng", "qi_xu_zheng", "shen_qi_bu_gu"],
  "can_evolve_to": ["qi_tuo_zheng", "shen_qi_bu_gu"],
  "common_in": ["素體稟賦不足者", "形體瘦長之人", "平時飲食不節者", "房勞過度者", "胎次過多者", "中老年"],
  "clinical_variants": [
    {
      "name": "久泄型",
      "cause": "多因飲食勞倦、內傷脾胃，胃虛則無以腐谷，脾虛則無以運化，日久元氣虧損",
      "symptoms": ["大便稀薄", "久泄不止", "下利無度", "大便隨矢氣而溢出", "神疲納呆", "少腹脹滿"],
      "treatment": "溫澀固脫、補益元氣",
      "formula": "河黎勒散",
      "formula_source": "《金匱要略》"
    },
    {
      "name": "胃脘痛型",
      "cause": "多因飲食不節、思慮傷脾、脾氣不升，無以運化水穀精微濡養臟腑、四肢百骸",
      "symptoms": ["形體羸瘦", "胃脘脹滿疼痛", "食後更甚", "內臟下垂", "頭暈眼花", "神疲乏力"],
      "treatment": "益氣健脾、升舉中氣",
      "formula": "補中益氣湯加減",
      "formula_source": "《脾胃論》"
    },
    {
      "name": "脫肛型",
      "cause": "多因老年而元氣虧損、便艱而努責不收、泄瀉而大腸鬆弛所致",
      "symptoms": ["便後脫肛", "無力自收", "納而復出", "面黃倦怠"],
      "treatment": "補益元氣、升舉提陷",
      "formula": "補中益氣湯加參蘆等",
      "formula_source": "《脾胃論》"
    },
    {
      "name": "陰挺型",
      "cause": "多見於胎產過多、或挑舉用力、勞累過度之婦女，元氣不足、胞脈受損、宗筋鬆弛",
      "symptoms": ["少腹脹墜", "子宮下垂", "面色萎黃", "乏力"],
      "treatment": "益氣培元、升舉胞宮",
      "formula": "補中益氣湯加青皮、山梔等",
      "formula_source": "《脾胃論》"
    }
  ],
  "differentiation": [
    {
      "compare_with": "qi_tuo",
      "compare_name": "氣脫證",
      "similarities": ["皆由氣虛發展而來", "病變基礎是氣虛"],
      "differences": {
        "this_pattern": "病勢緩慢、病情遷延，主要為中下焦元氣升舉無力的表現，可見脘腹脹墜、脫肛下利等",
        "other_pattern": "多見於暴病或慢性病晚期，病勢危急，主要為全身性正氣衰竭的表現，可見大汗淋漓、面色蒼白、精神萎靡、脈微欲絕"
      },
      "key_points": [
        "本證主要見於慢性疾病，氣脫證還可見於急性疾病如大失血時的氣隨血脫",
        "氣脫證病機是元氣衰竭、正氣虛脫；本證病機是元氣不足、脾氣不升、中氣下陷",
        "氣脫證急需益氣固脫搶救；本證則宜升舉中氣、緩緩圖治"
      ]
    },
    {
      "compare_with": "qingyang_busheng",
      "compare_name": "清陽不升證",
      "similarities": ["皆為氣機失常的病證", "都表現為氣的升舉功能減退"],
      "differences": {
        "this_pattern": "主要是脾氣不升、中氣下陷，臨床見症以中下焦症狀為主，純屬於虛證",
        "other_pattern": "主要針對濁陰不降而言，以上焦見症為主如頭暈眼花、耳鳴，臨床多見虛實夾雜證"
      },
      "key_points": [
        "清陽不升證以陽氣不升為主、濁陰不降為次",
        "清陽不升證亦可因痰濁中阻而見實證表現",
        "氣陷證純屬虛證，以中下焦症狀為主"
      ]
    },
    {
      "compare_with": "qi_xu",
      "compare_name": "氣虛證",
      "similarities": ["皆為虛證", "氣陷證多為氣虛證演化而來，兩者有因果關係"],
      "differences": {
        "this_pattern": "除氣虛表現外，更突出中氣下陷、元氣升舉無力的表現，可見少腹脹墜、下利脫肛、子宮下垂，病變部位主要在中下焦",
        "other_pattern": "主要指全身的元氣不足、臟腑功能衰退，可因疾病部位不同而臨床表現各異"
      },
      "key_points": [
        "氣虛證是基礎，氣陷證是發展",
        "氣陷證突出「下陷」的特點",
        "氣虛證範圍較廣，氣陷證病位較專"
      ]
    },
    {
      "compare_with": "shen_qi_bu_gu",
      "compare_name": "腎氣不固證",
      "similarities": ["皆屬虛證", "均可見下焦的病症如泄瀉、少腹脹等"],
      "differences": {
        "this_pattern": "病變部位主要在中焦脾胃，以脾氣不升、中氣下陷的症狀為主，每每伴有神疲納呆",
        "other_pattern": "病變部位主要在下焦腎，以腎氣無以溫煦助運、氣化失司、下關不固的症狀為主，每每伴有腰膝酸軟"
      },
      "key_points": [
        "腎氣不固證可由氣陷證發展而來",
        "腎氣不固證可見五更泄瀉，氣陷證見久泄不禁",
        "腎氣不固證可見遺精、滑精、淋濁、小便失禁等腎關不固之症"
      ]
    }
  ],
  "literature": [
    {
      "source": "《靈樞·口問》",
      "quote": "中氣不足，溲便為之變。"
    },
    {
      "source": "《諸病源候論·痢病諸候》",
      "quote": "脫肛候：脫肛者，肛門脫出也，多因久痢後大腸虛冷所為。肛門為大腸之候，大腸虛而傷於寒痢，而用氣喘，其氣下沖，則肛門脫出，因謂脫肛也。"
    },
    {
      "source": "《諸病源候論·婦人雜病諸候》",
      "quote": "陰挺出下脫候：胞絡傷損，子臟虛冷，氣下沖則令陰挺出，謂之下脫。亦有因產而用力偃氣，而陰下脫者。"
    },
    {
      "source": "《景岳全書·淋濁》",
      "quote": "淋如白濁者，此惟中氣下陷及命門不固之證也。"
    },
    {
      "source": "《景岳全書·新方八陣》",
      "quote": "舉元煎：治氣虛下陷、血崩、血脫、亡陽垂危等證。"
    },
    {
      "source": "《醫宗金鑒·婦科心法要訣》",
      "quote": "婦人經行之後，淋瀝不止，名曰經漏，經忽然大下不止，名曰經崩。……更有憂思傷脾，脾虛不能攝血者；有中氣下陷，不能固血者……"
    }
  ],
  "related_diseases": ["disease_tuogang", "disease_yinting", "disease_jiuxie", "disease_weixiacui"],
  "description": "中氣下陷證是氣虛證的進一步發展，由於脾氣虛弱，升舉無力，導致清陽下陷，臟器不能維持正常位置。氣陷證主要表現在脾氣不升、中氣下陷上，故與脾胃關係非常密切。然而氣屬陽，脾氣不升，進一步會造成脾陽不振而見水濕逗留，聚濕生痰的痰飲內停等病症。中氣下陷，進一步由脾及腎，造成腎氣不固而見遺溺、小便失禁等症。本證因中氣下陷而脾虛失運，中焦化源匱乏，氣不生血而導致血虛，出現氣血兩虛的眩暈、心悸。同時，由於中氣下陷、元氣不足，會造成氣不攝血而發生出血，如便血、月經過多等。",
  "source": "《中醫診斷學》"
}
