{
  "id": "qi_tuo_zheng",
  "name": "氣脫證",
  "alias": ["脫證", "元氣外脫證"],
  "zhengsu_composition": {
    "location": [],
    "nature": ["qi_tuo"]
  },
  "pathogenesis": "氣脫證是指機體正氣虛怯，元氣衰竭，臟腑機能極度的虛衰欲絕而出現的生命危急症狀的證候。本證多為外感或內傷，久病不愈，正不勝邪，或外傷、崩中、產後大出血、霍亂、泄瀉等病因所致。常為病情突然變化而出現的危重證候，故應積極搶救。本證與肺、脾、腎三臟關係密切。",
  "symptoms": {
    "main": ["突然大汗淋漓", "精神萎靡", "目合口張", "面色蒼白", "氣短不續", "二便自遺"],
    "secondary": ["手撒肢冷", "神志恍惚"],
    "tongue": "舌淡胖",
    "pulse": "脈細微，或扎大"
  },
  "treatment_principle": ["益氣固脫", "回陽救逆"],
  "recommended_formulas": ["dushen_tang", "shenfu_tang", "shengmai_san"],
  "recommended_herbs": ["ren_shen", "fu_zi", "wu_wei_zi", "long_gu", "mu_li"],
  "evolved_from": ["qi_xu_zheng", "zhong_qi_xia_xian"],
  "can_evolve_to": ["wang_yin_zheng", "wang_yang_zheng"],
  "differentiate_from": ["wang_yin_zheng", "wang_yang_zheng", "qi_jue_zheng", "zhong_qi_xia_xian"],
  "common_in": ["陽氣素虛者", "久病不愈者", "老年體弱者", "產後大出血者"],
  "clinical_variants": [
    {
      "name": "外感熱病昏迷前型",
      "cause": "多因外感熱病不愈，邪熱羈留，消爍津液所致",
      "symptoms": ["汗出或馮下", "精神萎倦", "目合氣短", "手足瘛瘲", "舌絳苔少", "脈氣虛弱", "時時欲脫"],
      "treatment": "滋液熄風、益氣固脫",
      "formula": "大定風珠",
      "formula_source": "《溫病條辨》"
    },
    {
      "name": "素體腎虛久病不愈型",
      "cause": "素體腎虛，元氣不足，久病不愈引起",
      "symptoms": ["大汗淋漓", "精神萎頓", "面色蒼白", "舌淡胖", "脈微細"],
      "treatment": "益氣固脫、止欲救逆",
      "formula": "獨參湯",
      "formula_source": "《十藥神書》"
    },
    {
      "name": "戰汗太過型",
      "cause": "因戰汗太過而致本證者，多為溫邪始終留戀氣分而未入營分，正邪交爭",
      "symptoms": ["戰汗後汗出肢冷", "煩躁不寧", "脈急疾"],
      "treatment": "益氣養液而救脫",
      "formula": "獨參湯或生脈散",
      "formula_source": "《內外傷辨惑論》"
    },
    {
      "name": "中風脫證型",
      "cause": "凡人逾四旬，氣衰之際，或因憂喜忿怒傷其氣者。元氣旷乏，肝腎不足，虛風內動所致",
      "symptoms": ["猝然暈仆", "面色蒼白", "目合口張", "手撒肢冷", "二便自遺", "口眼喎斜", "半身不遂", "舌痿言蹇", "脈細微"],
      "treatment": "益氣救脫",
      "formula": "獨參湯或參附湯",
      "formula_source": "《婦人良方》"
    },
    {
      "name": "血崩氣脫型",
      "cause": "多因飲食勞倦所傷，或思慮過度，以致脾胃氣虛，元氣旷乏，氣不攝血，沖任不固",
      "symptoms": ["經水過多", "色淡如水", "兩目昏黑", "眩暈", "顏面蒼白", "精神萎頓", "納呆少氣", "腰酸肢軟", "舌淡胖", "脈細微"],
      "treatment": "益氣攝血、固脫",
      "formula": "舉元煎",
      "formula_source": "《景岳全書》"
    },
    {
      "name": "產後失血過多型",
      "cause": "多因胎產過多，或胞宮受損，沖任空虛，元氣衰竭，大量出血，氣隨血脫",
      "symptoms": ["產後出血不止", "惡露連綿", "冷汗淋漓", "神困乏力", "面白自睛", "氣短肢冷", "舌淡", "脈虛大而扎"],
      "treatment": "益氣固脫、回陽救逆",
      "formula": "參附湯合生脈散",
      "formula_source": ""
    },
    {
      "name": "眼科氣脫型",
      "cause": "五臟精氣的虛脫，因五臟精氣衰竭，無以上榮於目所致",
      "symptoms": ["兩眼乾澀", "雙目失明", "或瞳仁散大"],
      "treatment": "益氣明目",
      "formula": "",
      "formula_source": ""
    },
    {
      "name": "小兒氣脫型",
      "cause": "小兒因稟賦不足，元氣虧損，稚陽之體每易受外邪侵襲而突發高熱",
      "symptoms": ["汗出", "鼻煽氣促", "或下痢不止", "精神萎靡", "氣短不續"],
      "treatment": "益氣固脫",
      "formula": "",
      "formula_source": ""
    }
  ],
  "differentiation": [
    {
      "compare_with": "wang_yin_zheng",
      "compare_name": "亡陰證",
      "similarities": ["二者均為危急證候", "且都有大汗淋漓的表現"],
      "differences": {
        "this_pattern": "因大汗淋漓致使津液耗損，氣虛而脫，但只是精神萎靡，尚未出現昏迷",
        "other_pattern": "多因邪熱內陷，真陰消爍，或汗出過多、下利不止等造成陰液耗竭，陰不制陽，陰陽離決。證見神志昏迷、精神萎頓、汗出如油、顴紅升火、咽干、舌紅絳、苔光剝、脈虛細帶數"
      },
      "key_points": [
        "氣脫證可為亡陰證的前奏",
        "氣脫證尚未出現昏迷，亡陰證已見神志昏迷",
        "亡陰證有陰虛內熱表現如顴紅升火、舌紅絳"
      ]
    },
    {
      "compare_with": "wang_yang_zheng",
      "compare_name": "亡陽證",
      "similarities": ["二者均為危急證候", "且都有大汗淋漓的表現"],
      "differences": {
        "this_pattern": "因大汗淋漓，致使氣虛欲脫，但未出現昏迷，只是精神困乏",
        "other_pattern": "多為真陽衰微，或汗出過多、下利不止等造成陽氣衰竭，陽不戀陰，陰陽離決。證見昏迷不醒、汗出肢冷、目合口張、手撒肢厥、二便自遺、鼻息低微、舌質淡、脈微細欲絕"
      },
      "key_points": [
        "氣脫證可為亡陽證的先驅證候",
        "氣脫證未出現昏迷，亡陽證已昏迷不醒",
        "亡陽證脈微細欲絕，較氣脫證更為危重"
      ]
    },
    {
      "compare_with": "qi_jue_zheng",
      "compare_name": "氣厥證",
      "similarities": ["二者均為危急證候", "且都與「氣」的病理變化有關"],
      "differences": {
        "this_pattern": "是因元氣不足，氣不固攝所出現的大汗淋漓、精神萎頓的症狀。屬虛證",
        "other_pattern": "多因七情所傷，惱怒驚駭，肝鬱不達，怒則氣上，造成氣機逆亂，填塞胸臆，擾亂神明所致。證見突然昏倒、不省人事、肢冷抽搐等。屬實證"
      },
      "key_points": [
        "氣脫證屬虛證，氣厥證屬實證",
        "氣脫證大汗淋漓，氣厥證無明顯汗出",
        "病因、病機、症狀各不相同"
      ]
    },
    {
      "compare_with": "zhong_qi_xia_xian",
      "compare_name": "中氣下陷證",
      "similarities": ["皆由氣虛發展而來", "病變基礎是氣虛"],
      "differences": {
        "this_pattern": "多見於暴病或慢性病晚期，病勢危急，主要為全身性正氣衰竭的表現，可見大汗淋漓、面色蒼白、精神萎靡、脈微欲絕",
        "other_pattern": "病勢緩慢、病情遷延，主要為中下焦元氣升舉無力的表現，可見脘腹脹墜、脫肛下利等"
      },
      "key_points": [
        "氣脫證病勢危急，需搶救",
        "中氣下陷證病勢緩慢，緩緩圖治",
        "中氣下陷證可發展為氣脫證"
      ]
    }
  ],
  "literature": [
    {
      "source": "《靈樞·通天篇》",
      "quote": "陰陽皆脫者，暴死不知人。"
    },
    {
      "source": "《難經·二十難》",
      "quote": "脫陽者，視其暗中見鬼。"
    },
    {
      "source": "《金匱要略·血痹虛勞病脈證並治》",
      "quote": "脈沉小遲名脫氣，其人疾行則喘喝，手足逆冷，腹滿，甚則溏泄，食不消化也。"
    },
    {
      "source": "《景岳全書·婦人規》",
      "quote": "產時胞胎既下，氣血俱去，忽爾眼黑頭眩，神昏口噤，昏不知人。古人多云惡露乘虛上攻，故致血暈，不知此證有二：曰血暈，曰氣脫也。若以氣脫作血暈，而用辛香逐血化痰等劑，則立刻斃矣，不可不慎也。"
    },
    {
      "source": "《臨證指南醫案·脫》徐靈胎評",
      "quote": "脫之名，惟陽氣驟越，陰陽相離，汗出如油，六脈垂絕，一時急迫之症，方名為脫。"
    }
  ],
  "related_diseases": ["disease_hunmi", "disease_zhanhan", "disease_zhongfeng", "disease_benglou", "disease_chanhouxueyun"],
  "description": "氣脫證是氣虛證發展到極危重階段的表現，元氣衰竭，正氣虛脫。本證與肺、脾、腎三臟關係密切。臨床多因肺脾氣虛，猝然大汗淋漓而致本證；亦可因脾腎氣虛，驟作下利不止而致本證。故本證可因氣虛不足發展而來。汗出，可因氣虛不固、腠理疏松所致；氣屬陽，陽氣不能衛外而泄越亦可見汗出，故大汗淋漓必傷陽氣，氣脫亦可導致亡陽。汗為津液所化，氣虛不固，汗出不止，津液外泄，會傷津亡液，說明氣脫亦可導致亡陰。臨床應重視氣脫證的搶救，待元氣來復後，當抓住造成各病證的病因及出現的臨床症狀，或後遺症，進行針對性的治療，否則，氣脫證會再度出現，病情會更趨危重。",
  "source": "《中醫診斷學》"
}
